{
  "@context": "https://schema.agennext.dev/agent-fabric/context.jsonld",
  "id": "af:graph/snapshot-2026-06-07T12-00",
  "kind": "Graph",
  "tenant": "agennext",
  "watermark": {
    "asOf": "2026-06-07T12:00:00Z",
    "sequence": 42,
    "stream": "agennext.core"
  },
  "nodes": [
    {
      "id": "af:workspace/research",
      "kind": "Workspace",
      "label": "Research",
      "attributes": { "environment": "prod", "purpose": "Autonomous research squad" }
    },
    {
      "id": "af:agent/orchestrator-7",
      "kind": "Agent",
      "label": "Orchestrator-7",
      "scope": "af:workspace/research",
      "attributes": { "role": "orchestrator", "model": "claude-opus-4-8", "autonomyLevel": "autonomous", "status": "busy" },
      "observedAt": "2026-06-07T11:59:50Z",
      "provenance": { "source": "agent-platform", "confidence": 1 }
    },
    {
      "id": "af:agent/researcher-3",
      "kind": "Agent",
      "label": "Researcher-3",
      "scope": "af:workspace/research",
      "attributes": { "role": "executor", "model": "claude-sonnet-4-6", "autonomyLevel": "semi-autonomous", "status": "busy" }
    },
    {
      "id": "af:team/research-squad",
      "kind": "Team",
      "label": "Research Squad",
      "scope": "af:workspace/research",
      "attributes": { "topology": "hub-and-spoke", "size": 2 }
    },
    {
      "id": "af:tool/web-search",
      "kind": "Tool",
      "label": "Web Search",
      "attributes": { "protocol": "mcp", "sideEffects": "read-only" }
    },
    {
      "id": "af:runtime/k8s-prod-eu",
      "kind": "Runtime",
      "label": "k8s-prod-eu",
      "attributes": { "platform": "kubernetes", "region": "eu-west-1", "health": "healthy" }
    },
    {
      "id": "af:identity/sa-researcher",
      "kind": "Identity",
      "label": "sa-researcher",
      "attributes": { "principalType": "service-account", "issuer": "agent-identity" }
    },
    {
      "id": "af:policy/web-readonly",
      "kind": "Policy",
      "label": "Web read-only",
      "attributes": { "policyType": "access", "effect": "allow", "ruleRef": "iga:rule/web-readonly" }
    },
    {
      "id": "af:trace/run-91af",
      "kind": "Trace",
      "label": "run-91af",
      "attributes": { "traceRef": "traces:run-91af", "outcome": "success" }
    }
  ],
  "edges": [
    { "id": "af:rel/1", "relation": "MEMBER_OF", "from": "af:agent/orchestrator-7", "to": "af:team/research-squad" },
    { "id": "af:rel/2", "relation": "MEMBER_OF", "from": "af:agent/researcher-3", "to": "af:team/research-squad" },
    { "id": "af:rel/3", "relation": "DELEGATES_TO", "from": "af:agent/orchestrator-7", "to": "af:agent/researcher-3", "weight": 0.8 },
    { "id": "af:rel/4", "relation": "USES", "from": "af:agent/researcher-3", "to": "af:tool/web-search" },
    { "id": "af:rel/5", "relation": "INVOKES", "from": "af:agent/researcher-3", "to": "af:tool/web-search", "weight": 17, "observedAt": "2026-06-07T11:59:50Z", "attributes": { "callCount": 17 } },
    { "id": "af:rel/6", "relation": "RUNS_ON", "from": "af:agent/researcher-3", "to": "af:runtime/k8s-prod-eu" },
    { "id": "af:rel/7", "relation": "DEPLOYED_IN", "from": "af:runtime/k8s-prod-eu", "to": "af:workspace/research" },
    { "id": "af:rel/8", "relation": "ASSUMES_IDENTITY", "from": "af:agent/researcher-3", "to": "af:identity/sa-researcher" },
    { "id": "af:rel/9", "relation": "GOVERNED_BY", "from": "af:tool/web-search", "to": "af:policy/web-readonly" },
    { "id": "af:rel/10", "relation": "PRODUCED", "from": "af:agent/researcher-3", "to": "af:trace/run-91af" },
    { "id": "af:rel/11", "relation": "EVIDENCED_BY", "from": "af:rel/5", "to": "af:trace/run-91af" }
  ]
}
